{
  "family_id": "cloth_fabric_simulation_program_system",
  "style_id": "industrial_pbr_v1",
  "policy_ids": [
    "panelized_hard_surface_object"
  ],
  "domain": "hard_surface",
  "description": "cloth_fabric_simulation_program_system: Cycle 3 migration to declarative knowledge packs. The recipe's 10-op canonical pattern is reproduced through a typed NODE_TYPE construction graph driven by the panelized_hard_surface_object composition policy. Routes through the procedural synthesizer (Cycle 3 Round 6 decommissioned the legacy _RECIPES dispatch). Per-alias build-artifact integration test: tests/integration/test_recipe_migration_build_artifact_diff.py. Domain-specific (vegetation/terrain/sdf/etc.) DomainExtension packs land in Cycle 6; this alias remains semantic-correct and routing-valid under the hard_surface domain in the interim."
}
