{
  "family_id": "tool_prop",
  "style_id": "industrial_pbr_v1",
  "policy_ids": [
    "panelized_hard_surface_object"
  ],
  "domain": "hard_surface",
  "description": "Tool prop fixture (body, grip handle, working-head guard, spine rail, safety guard, adjustment mount, attachment sockets, fasteners, marking decals, contact wear). Routes through the procedural synthesizer (Cycle 3 Round 6 decommissioned the legacy _RECIPES dispatch). Per-alias build-artifact integration test: tests/integration/test_recipe_migration_build_artifact_diff.py."
}
