{
  "family_id": "mechanical_door",
  "style_id": "industrial_pbr_v1",
  "policy_ids": [
    "panelized_hard_surface_object"
  ],
  "domain": "hard_surface",
  "description": "Mechanical door fixture (frame, door leaf panel, hinge stack, lock-actuator inset, threshold rails, panel-groove trim, access handle, fasteners, warning decals, edge wear). Routes through the procedural synthesizer (Cycle 3 Round 6 decommissioned the legacy _RECIPES dispatch). Per-alias build-artifact integration test: tests/integration/test_recipe_migration_build_artifact_diff.py."
}
