{
  "family_id": "environment_effect",
  "style_id": "industrial_pbr_v1",
  "policy_ids": [
    "panelized_hard_surface_object"
  ],
  "domain": "hard_surface",
  "description": "Environment effect emitter fixture (emitter volume, flow / material-response zones, motion-line rails, contact wear, particle fasteners, density-band trim, boundary frame, readability decals, dynamic wear). Routes through the procedural synthesizer (Cycle 3 Round 6 decommissioned the legacy _RECIPES dispatch). Per-alias build-artifact integration test: tests/integration/test_recipe_migration_build_artifact_diff.py."
}
