{
  "family_id": "weapon_prop",
  "style_id": "industrial_pbr_v1",
  "policy_ids": [
    "panelized_hard_surface_object"
  ],
  "domain": "hard_surface",
  "description": "Weapon prop fixture (primary body volume, grip handle, hand guard, active-edge rail, centerline trim, end-cap mount, hardpoint sockets, fasteners, marking decals, edge wear). Recipe-equivalent op intent verified by tests/contract/test_recipe_migration_shape_program_diff.py."
}
